{
  "$schema": "https://json-schema.org/draft/2020-12/schema",
  "$id": "schema://ioi/foundations/objects/work-frontier-item-envelope/v1",
  "title": "WorkFrontierItemEnvelope",
  "x-ioi-schema-version": "ioi.foundations.work-frontier-item-envelope.v1",
  "description": "The room's claimable graph of questions, problems, hypotheses, tasks, reviews, verification needs, and resource needs. Derived field-for-field from the canon definition at docs/architecture/foundations/objects/collaborative-pursuit.md#workfrontieritemenvelope -- every property, every closed enumeration, and every nullability below is transcribed from that YAML block, not invented here.",
  "type": "object",
  "additionalProperties": false,
  "required": [
    "schema_version",
    "frontier_item_id",
    "system_binding",
    "item_kind",
    "objective",
    "duplication_policy",
    "claimability",
    "status"
  ],
  "properties": {
    "schema_version": {
      "const": "ioi.foundations.work-frontier-item-envelope.v1"
    },
    "frontier_item_id": {
      "type": "string",
      "pattern": "^[a-z][a-z0-9+._-]*://[^\\s]{1,500}$"
    },
    "system_binding": {
      "type": "object",
      "description": "SystemScopedObjectBinding. Owned by its own contract and deliberately left opaque here: this registration transcribes the WorkFrontierItemEnvelope definition and does not get to invent a neighbouring family's shape."
    },
    "item_kind": {
      "enum": [
        "question",
        "problem",
        "hypothesis",
        "task",
        "review_need",
        "verification_need",
        "resource_need",
        "synthesis_need"
      ]
    },
    "objective": {
      "type": "string",
      "minLength": 1
    },
    "dependency_refs": {
      "type": "array",
      "items": {
        "type": "string",
        "pattern": "^[a-z][a-z0-9+._-]*://[^\\s]{1,500}$"
      }
    },
    "related_attempt_and_finding_refs": {
      "type": "array",
      "items": {
        "type": "string",
        "pattern": "^[a-z][a-z0-9+._-]*://[^\\s]{1,500}$"
      }
    },
    "required_capability_refs": {
      "type": "array",
      "items": {
        "type": "string",
        "pattern": "^[a-z][a-z0-9+._-]*://[^\\s]{1,500}$"
      }
    },
    "required_context_resource_authority_and_evidence_refs": {
      "type": "array",
      "items": {
        "type": "string",
        "description": "A URI-shaped ref (context-profile://, resource://, evidence://) or a scope: selector, per canon.",
        "pattern": "^(?:[a-z][a-z0-9+._-]*://[^\\s]{1,500}|scope:[a-z0-9*._-]{1,200})$"
      }
    },
    "expected_value": {
      "oneOf": [
        {
          "type": "number"
        },
        {
          "type": "null"
        }
      ]
    },
    "uncertainty": {
      "oneOf": [
        {
          "type": "number"
        },
        {
          "type": "null"
        }
      ]
    },
    "priority": {
      "oneOf": [
        {
          "type": "number"
        },
        {
          "type": "null"
        }
      ]
    },
    "duplication_policy": {
      "enum": [
        "exclusive",
        "allowed",
        "encouraged",
        "independent_replication_required"
      ]
    },
    "claimability": {
      "enum": [
        "open",
        "invited_only",
        "assigned",
        "paused",
        "closed"
      ]
    },
    "max_concurrency": {
      "oneOf": [
        {
          "type": "integer",
          "minimum": 1,
          "maximum": 9007199254740991
        },
        {
          "type": "null"
        }
      ]
    },
    "expires_at": {
      "oneOf": [
        {
          "type": "string",
          "pattern": "^[0-9]{4}-(?:0[1-9]|1[0-2])-(?:0[1-9]|[12][0-9]|3[01])T(?:[01][0-9]|2[0-3]):[0-5][0-9]:(?:[0-5][0-9]|60)(?:[.][0-9]+|)(?:Z|[+-](?:[01][0-9]|2[0-3]):[0-5][0-9])$"
        },
        {
          "type": "null"
        }
      ]
    },
    "stop_condition_ref": {
      "oneOf": [
        {
          "type": "string",
          "pattern": "^[a-z][a-z0-9+._-]*://[^\\s]{1,500}$"
        },
        {
          "type": "null"
        }
      ]
    },
    "status": {
      "enum": [
        "open",
        "claimed",
        "blocked",
        "replicating",
        "verifying",
        "accepted",
        "rejected",
        "superseded",
        "closed"
      ]
    }
  }
}
