{
  "schema_version": "ioi.foundations.work-frontier-item-envelope.v1",
  "frontier_item_id": "frontier://room/outcome-1/item/7",
  "system_binding": {
    "system_id": "system://ioi/hypervisor"
  },
  "item_kind": "verification_need",
  "objective": "Reproduce the reported refusal on a real subject.",
  "duplication_policy": "independent_replication_required",
  "claimability": "open",
  "status": "open"
}
